{
  "schema_version": "new-api-license-review/v1",
  "status": "APPROVED",
  "distribution": "ghcr.io/mlhjyx/new-api OCI image plus public corresponding source",
  "reviewed_license_expressions": [
    "0BSD",
    "AGPL-3.0-only",
    "Apache-2.0",
    "Apache-2.0 OR MIT",
    "BSD-2-Clause",
    "BSD-3-Clause",
    "(BSD-3-Clause OR GPL-2.0)",
    "ISC",
    "MIT",
    "MPL-2.0",
    "(MPL-2.0 OR Apache-2.0)",
    "OFL-1.1",
    "Unlicense"
  ],
  "dependency_resolutions": [
    {
      "ecosystem": "Go",
      "name": "github.com/Calcium-Ion/go-epay",
      "previous_version": "v0.0.4",
      "resolved_version": "v0.0.5",
      "artifact_integrity": "h1:TgIx44c/bhdFqso4kbmDzZFzgyDJLma5hMDNA6sOXbo=",
      "license_expression": "MIT",
      "license_file_sha256": "86f028deb5895d8994571a0393face710851c29bb938e9b23fe7a9828efd99a8",
      "bundle_reachability": "runtime-linked",
      "decision": "UPGRADED_TO_EXACT_LICENSED_COMMIT",
      "evidence_uri": "https://github.com/Calcium-Ion/go-epay/blob/b6694eb473b09a94decd8ee71f9946156fda5e17/LICENSE"
    },
    {
      "ecosystem": "npm",
      "name": "@giscus/react",
      "previous_version": "3.1.0",
      "resolved_version": "NOT_PRESENT",
      "artifact_integrity": "sha512-0TCO2TvL43+oOdyVVGHDItwxD1UMKP2ZYpT6gXmhFOqfAJtZxTzJ9hkn34iAF/b6YzyJ4Um89QIt9z/ajmAEeg==",
      "license_expression": "NOASSERTION",
      "license_file_sha256": "",
      "bundle_reachability": "absent-from-lock-install-and-frozen-bundles",
      "decision": "REMOVED_BY_PRIVATE_LOCAL_ADAPTER",
      "evidence_uri": "https://registry.npmjs.org/@giscus/react/3.1.0"
    },
    {
      "ecosystem": "npm",
      "name": "@splinetool/runtime",
      "previous_version": "1.12.98",
      "resolved_version": "NOT_PRESENT",
      "artifact_integrity": "sha512-UWZH/+4XtNgMMgmDiWhZS55WOwUDGuTj4uH6fiZV6Jol3d3v3z1RRBObspx8GMio0HajOYGg7FJ8TZdyBdpW4A==",
      "license_expression": "NOASSERTION",
      "license_file_sha256": "",
      "bundle_reachability": "absent-from-lock-install-and-frozen-bundles",
      "decision": "REMOVED_BY_PRIVATE_LOCAL_ADAPTER",
      "evidence_uri": "https://registry.npmjs.org/@splinetool/runtime/1.12.98"
    },
    {
      "ecosystem": "local",
      "name": "@lobehub/ui",
      "previous_version": "5.22.3",
      "resolved_version": "workspace:shared/lobe-ui-adapter@5.0.0",
      "artifact_integrity": "sha256:beba0d5f7daa8ae401d665603edfa67db08ea95f999ac856d619375bb012ef61",
      "license_expression": "AGPL-3.0-only",
      "license_file_sha256": "8486a10c4393cee1c25392769ddd3b2d6c242d6ec7928e1414efff7dfb2f07ef",
      "bundle_reachability": "runtime-bundled-five-primitive-compatibility-surface",
      "decision": "REPLACED_WITH_PRIVATE_NON_PUBLISHABLE_ADAPTER",
      "evidence_uri": "https://www.gnu.org/licenses/agpl-3.0.txt"
    }
  ],
  "evidence": {
    "go_mod_sha256": "785733e1ab835b0ef3213ec2afdd56ef2fd275171b8bb860ec27f418d600b247",
    "go_sum_sha256": "8393c63f752f7ce7badd3b6562186e076f2bda0f4a8c7746d049e499fae3a3e4",
    "bun_lock_sha256": "a3e4554156d162cba54c5151e22e534cfa338195e259a22b2915db26d1c94585",
    "electron_lock_sha256": "1943bfd4a8874c2ba36a8b584598106561c8d9635932a174f71d4e0fa78c840f",
    "adapter_sha256": "beba0d5f7daa8ae401d665603edfa67db08ea95f999ac856d619375bb012ef61",
    "license_sha256": "8486a10c4393cee1c25392769ddd3b2d6c242d6ec7928e1414efff7dfb2f07ef",
    "upstream_notice_sha256": "528067fcdf4f9d7e3fdb489d02cbdd36a0efa63fc2eb1686340612c26beb9f33"
  },
  "unresolved": []
}
